{
  "id": "pretextbooks/introduction-to-working-with-data-in-ghana",
  "title": "Introduction to Working with Data in Ghana",
  "description": "A practical, data-first introduction to working with real data in R, set in a Ghanaian context. Each chapter opens with a real case study and an interactive STACK question, then works through the skills that come before any trustworthy result: understanding how data is structured, exploring and cleaning it, reshaping it, handling factors and missing values, and measuring and accounting for variability. No prior R experience is needed, and no mathematics beyond arithmetic. This variant is the Ghana version, with the Kenyan context replaced by Ghana.",
  "authors": [
    "Lily Clements"
  ],
  "url": "https://idemsinternational.pages.idems.international/iwd-svc-ghana/meta-front.html",
  "language": "en",
  "software": [
    "R"
  ],
  "subject": [
    "general"
  ],
  "keywords": [
    "R programming",
    "working with data",
    "data wrangling",
    "data cleaning",
    "data visualisation",
    "exploratory data analysis",
    "multilevel data",
    "Simpson's paradox",
    "data reshaping",
    "factors",
    "missing data",
    "variability",
    "ANOVA",
    "ggplot2",
    "dplyr",
    "tidyr",
    "introductory statistics",
    "introductory data science",
    "case studies",
    "STACK questions",
    "Africa",
    "Ghana"
  ],
  "meta": {
    "license": "CC-NC-SA",
    "difficulty": "introductory",
    "variant": true,
    "variantOf": "pretextbooks/introduction-to-working-with-data"
  }
}
