{
  "id": "pretextbooks/an-introduction-to-data-science-for-crfs",
  "title": "An Introduction to Data Science for CRFS",
  "description": "A  gentle introduction to data science for both technical and non-technical readers, using R for hands-on examples across data manipulation, visualisation, statistics, and data mining. Suitable as a standalone introductory course text or supplement to an advanced analytics course, and freely adaptable for non-commercial use. This variant is adapted for CRFS: the examples and context have been changed to fit CRFS work in Africa and the Sahel.",
  "authors": [
    "Original by Jeffrey Stanton; this variant is for CRFS"
  ],
  "url": "https://idemsinternational.pages.idems.international/data-science-in-r-svc-crfs/",
  "language": "en",
  "software": [
    "R"
  ],
  "subject": [
    "general",
    "agriculture"
  ],
  "keywords": [
    "introductory data science",
    "R programming",
    "data manipulation",
    "data visualisation",
    "statistical computing",
    "data mining",
    "support vector machines",
    "non-technical introduction",
    "analytics",
    "CRFS",
    "agriculture",
    "Africa",
    "Sahel"
  ],
  "meta": {
    "edition": "third",
    "license": "CC BY-NC-SA",
    "difficulty": "introductory",
    "variant": true,
    "variantOf": "pretextbooks/an-introduction-to-data-science"
  }
}
