{
  "id": "pretextbooks/statistics-minus-the-math",
  "title": "Statistics Minus The Math",
  "description": "An accessible introduction to statistics minimising mathematical formalism in favour of conceptual understanding and interpretation. Adapted largely from the open resource Online Statistics Education (Lane, Rice University).",
  "authors": [
    "Nathan Favero"
  ],
  "url": "https://pretextbooks.github.io/minus-the-math/frontmatter.html",
  "language": "en",
  "software": [
    "general"
  ],
  "subject": [
    "general",
    "social science"
  ],
  "keywords": [
    "introductory statistics",
    "social sciences",
    "applied statistics",
    "regression",
    "qualitative independent variables",
    "qualitative dependent variables",
    "hypothesis testing",
    "confidence intervals",
    "ANOVA",
    "probability distributions",
    "sampling distributions",
    "experimental design",
    "causality",
    "contingency tables",
    "conceptual statistics",
    "minimal math",
    "undergraduate statistics",
    "open educational resource"
  ],
  "meta": {
    "edition": "first",
    "license": "CC-BY",
    "difficulty": "intermediate"
  }
}
