{
  "id": "pretextbooks/south-sudan-secondary-mathematics-3",
  "title": "Secondary Mathematics 3",
  "description": "Secondary Mathematics 3 from the Republic of South Sudan's Ministry of General Education and Instruction, covering: Logarithms; measurement and geometry (accuracy, loci and the equation of a circle); algebra (quadratics, binomial expansion, sequences and series, matrices and transformations); and an introduction to calculus.",
  "authors": [
    "The Republic of South Sudan, Ministry of General Education and Instruction"
  ],
  "url": "https://idemsinternational.pages.idems.international/south-sudan-secondary-mathematics-3-svc/secondary-mathematics-3-2.html",
  "library": "mathematics",
  "language": "en",
  "software": [
    "general"
  ],
  "subject": [
    "math"
  ],
  "keywords": [
    "mathematics",
    "secondary mathematics",
    "South Sudan",
    "Africa",
    "logarithms",
    "accuracy and bounds",
    "loci",
    "equation of a circle",
    "quadratic equations",
    "binomial expansion",
    "sequences and series",
    "matrices",
    "transformations",
    "calculus",
    "differentiation",
    "integration"
  ],
  "meta": {
    "difficulty": "secondary"
  }
}
