{
  "id": "pretextbooks/introduction-to-working-with-data-in-python",
  "title": "Introduction to Working with Data in Python",
  "description": "A practical, data-first introduction to working with real data in Python, set in a Kenyan context. Each chapter opens with a real case study and an interactive STACK question, then works through the skills that come before any trustworthy result: understanding how data is structured, exploring and cleaning it, reshaping it, handling factors and missing values, and measuring and accounting for variability. No prior Python experience is needed, and no mathematics beyond arithmetic. This variant teaches the same material in Python instead of R, keeping the Kenyan context.",
  "authors": [
    "Lily Clements"
  ],
  "url": "https://idemsinternational.pages.idems.international/iwd-svc-python/",
  "language": "en",
  "software": [
    "Python"
  ],
  "subject": [
    "general"
  ],
  "keywords": [
    "working with data",
    "data wrangling",
    "data cleaning",
    "data visualisation",
    "exploratory data analysis",
    "multilevel data",
    "Simpson's paradox",
    "data reshaping",
    "factors",
    "missing data",
    "variability",
    "ANOVA",
    "introductory statistics",
    "introductory data science",
    "case studies",
    "STACK questions",
    "Kenya",
    "Africa",
    "Python programming"
  ],
  "meta": {
    "license": "CC-NC-SA",
    "difficulty": "introductory",
    "variant": true,
    "variantOf": "pretextbooks/introduction-to-working-with-data"
  }
}
