{
  "id": "pretextbooks/tidyverse-skills-for-data-science-in-r",
  "title": "Tidyverse Skills for Data Science in R",
  "description": "A practical guide to data science using the Tidyverse ecosystem in R, covering the full project lifecycle from data import and wrangling through visualisation and modelling using the Tidymodels framework. Aimed at R users looking to adopt a consistent, scalable tidy approach to data science.",
  "authors": [
    "Carrie Wright",
    "Shannon E. Ellis",
    "Stephanie C. Hicks",
    "Roger D. Peng"
  ],
  "url": "https://pretextbooks.github.io/tidyversecourse/frontmatter.html",
  "language": "en",
  "software": [
    "R"
  ],
  "subject": [
    "general"
  ],
  "keywords": [
    "Tidyverse",
    "R programming",
    "data science",
    "data wrangling",
    "data visualisation",
    "Tidymodels",
    "machine learning",
    "data import",
    "ggplot2",
    "dplyr",
    "tidyr",
    "modelling",
    "reproducible workflows"
  ],
  "meta": {
    "license": "CC-BY-NC 4.0",
    "difficulty": "intermediate"
  }
}
